{"architecture":"x86_64","baseline_digest":"b6195ed38de447e45b21a353ecc8b7d1157c0aae32bbe2ee2ba6a3dcd4d49a7b","baseline_id":"example-fedora44-x86_64-v1","builder_image_digest":"sha256:6666666666666666666666666666666666666666666666666666666666666666","dracut_config_sha256":"1e5b8ccebefad4e6e129b8130e224d80d9766498e3d7aecd3465eac293f64619","esp_payload_bytes":40,"esp_required_bytes":67108904,"fedora_release":"44","final_kernel_config_sha256":"cd4f317278ff7686c4aff93ebc4583ceadcd97b07245c78d70dbb4b946b9f42e","image_builder_identity":"c4a97688247fb11f52b31438ce971b0596192841df561413dc2751dec8458de5","image_input_identity":"0d02fc3043ca4520b3df25c9f30b63df7b923f54c9eea2166aa5d32c9ef03a3a","image_manifest_sha256":"127935f720de337a1642a4c1b3cbcd1fe39739a48d652c76eb350d3c7c6d57e9","image_sha256":"aaaaaaaaaaaaaaaaaaaaaaaaaaaaaaaaaaaaaaaaaaaaaaaaaaaaaaaaaaaaaaaa","image_size_bytes":4294967296,"initramfs_sha256":"714ccdf650429602a4008b42b0ecf3c063ec185adfbf3d07e5f6372e8f232f7d","kernel_release":"6.12.0-test","kernel_sha256":"66bc6d1072d313cc3962ad86ea819208b59c89f9037cd82b943c7bd481833e49","kernel_srpm_sha256":"ec1ef238c568d56312345df7d431eac630f592dc7ac808427d0ef82f93310143","layout":{"experiment_mib":32768,"factory_size_mib":4096,"library_mib":32768,"log_budget_mib":4096,"root_mib":2048},"module_files_digest":"66222e543f1c4d7c5e8714659e75df50dedb15ce5dbf9275fc4204bd3e53a33a","policy":{"firmware_writes":false,"internal_storage_access":false,"recovery_selinux":"disabled","root_read_only":true,"secure_boot":"disabled"},"profile_digest":"5fe6325b9fc0e415d5da8fe56207d12614b088370f97405b4a080eddb1972217","qualification_status":"unqualified","qualified_capabilities":[],"recipe_digest":"6890ef5dff8ec08900a541fb78f865dd157797e822937899d40856bc559a1c8d","record_type":"recovery-release-candidate","recovery_fragment_sha256":"703a370d7b5c711f574145508f3b54e020d87edb861d8789b4c16716a8484bea","rootfs_entry_count":307,"rootfs_file_bytes":2724530,"rootfs_lock_sha256":"397baf4c422dd23a6500db3acac3680c660289669fc06c786fb32de112b47d1b","rootfs_required_bytes":325916979,"rpm_snapshot_sha256":"7b4f430dc1f526928690efdbfef7654415133095de12975f1f2ba2d696f2431b","runtime_revision_sha256":"e654142d62dd5a07b1ffb6b3e8f2f67fc6da6f4331ef821d1c690a3b1fbeaa11","schema_version":1,"source_tree_sha256":"852ac3c28ca77db51061f6a9f76774f4761ce53fee8dfb5203e71e082a53eef5","target_rpm_lock_sha256":"a165680fdc68c0121149a4f503b09ae3a7899f2ad90ddfe1f5b920589e666ac9","toolchain_lock_sha256":"ec8f014b9a18c0b1dc5c86ecae109416d66d607898eb242973990e4d3ab7212d","unit_allowlist_sha256":"5b8c6eb11bb275deb63ba62f1596e2874a35ca7555ed2f546f7ef1ac9ed8a30c"}